{"$schema":"http://json-schema.org/draft-04/schema#","type":"object","required":["correlationId","eventType","eventTimestamp","retryCount","payload"],"properties":{"correlationId":{"type":"string","minLength":1},"eventType":{"type":"string","enum":["ORDER_RECEIVED"]},"eventTimestamp":{"type":"string"},"retryCount":{"type":"integer","minimum":0},"payload":{"type":"object","required":["orderId","orderDate","customer","shippingAddress","paymentMethod","currency","totalAmount","items"],"properties":{"orderId":{"type":"string","minLength":1},"orderDate":{"type":"string"},"customer":{"type":"object","required":["customerId","name","email"]},"shippingAddress":{"type":"object"},"paymentMethod":{"type":"string"},"currency":{"type":"string"},"totalAmount":{"type":"number"},"items":{"type":"array","minItems":1,"items":{"type":"object","required":["productId","quantity","unitPrice"],"properties":{"quantity":{"type":"integer","minimum":1},"unitPrice":{"type":"number","minimum":0.01}}}}}}}}
