{"correlationId":"b7f4c9e2-5d31-4a88-9c10-2f6ab7d5e910","eventType":"ORDER_RECEIVED","eventTimestamp":"2026-09-11T10:30:00.418+05:30","retryCount":0,"payload":{"orderId":"ORD-2026-1001","orderDate":"2026-09-11T10:30:00+05:30","customerId":"CUST-501","customerEmail":"arun.kumar@example.com","customer":{"customerId":"CUST-501","name":"Arun Kumar","email":"arun.kumar@example.com","phone":"+91-9876543210"},"shippingAddress":{"addressLine1":"21 Anna Salai","city":"Chennai","state":"Tamil Nadu","postalCode":"600002","country":"India"},"paymentMethod":"CARD","currency":"INR","totalAmount":3000.00,"itemCount":2,"items":[{"productId":"PROD-101","productName":"Wireless Keyboard","quantity":2,"unitPrice":1499.00},{"productId":"PROD-205","productName":"USB-C Mouse","quantity":1,"unitPrice":799.00}]}}
